<?xml version="1.0" encoding="UTF-8"?><shop xmlns:xsi="http://www.w3.org/2001/XMLSchema-instance" xsi:noNamespaceSchemaLocation="productlist.xsd">
	<categories>
		<category>
			<name>computers</name>
			<subcategories>
				<subcategory>
					<name>desktops</name>
					<product>
						<name>PRODUCT2</name>
						<producer>IBM</producer>
						<model>AA111</model>
						<dateOfIssue>01-01-2014</dateOfIssue>
						<color>grey</color>
						<notInStock/>
					</product>
				</subcategory>
				<subcategory>
					<name>laptops</name>
					<product>
						<name>laptop33!</name>
						<producer>IBM</producer>
						<model>AA111</model>
						<dateOfIssue>01-01-2014</dateOfIssue>
						<color>grey</color>
						<notInStock/>
					</product>
				</subcategory>
			</subcategories>
		</category>
		<category>
			<name>phones</name>
			<subcategories>
				<subcategory>
					<name>smartphones</name>
					<product>
						<name>smartphones1!!!!</name>
						<producer>IBM</producer>
						<model>AA111</model>
						<dateOfIssue>01-01-2014</dateOfIssue>
						<color>grey</color>
						<price>100</price>
					</product>
				</subcategory>
			</subcategories>
		</category>
	</categories>
</shop>